{
  "scenarioFolder": "LF10FIAE-Scenarien",
  "quizFolder": "LF10FIAE-Quiz",
  "scenarioFile": "ticket_ausbildungsbetrieb_ui_gestaltung_entwicklung/ticket01_V01_ausbildungsbetrieb_ui_gestaltung_entwicklung.json",
  "quizFile": "quiz_ausbildungsbetrieb_ui_gestaltung_entwicklung/quiz01_V01_ausbildungsbetrieb_ui_gestaltung_entwicklung.json",
  "ticketId": "01_easy_ausbildungsbetrieb_ui_gestaltung_entwicklung.json",
  "versionId": "V01",
  "title": "Ticket 01 - UI Projektstart + Folgeaufträge",
  "description": "Dummy-Daten für Ticket 01 - UI Projektstart + Folgeaufträge (V01) im DoomScrollQuiz.",
  "topics": [
    "Ausbildungsbetrieb Ui Gestaltung Entwicklung",
    "Version 01"
  ],
  "questions": [
    {
      "id": "quiz01_v01_ausbildungsbetrieb_ui_gestaltung_entwicklung_kernidee",
      "conceptId": "01_ausbildungsbetrieb_ui_gestaltung_entwicklung_kernidee",
      "variantId": "quiz01_v01_ausbildungsbetrieb_ui_gestaltung_entwicklung_kernidee",
      "isNew": true,
      "prompt": "Im Ticket 01 taucht die Fachaussage auf: \"Ausbildungsbetrieb Ui Gestaltung Entwicklung im Arbeitsalltag sicher einordnen und anwenden.\" Was hat er gesagt?",
      "maxSelections": 1,
      "options": [
        {
          "id": "quiz01_v01_ausbildungsbetrieb_ui_gestaltung_entwicklung_kernidee_a",
          "text": "Wir sollen ausbildungsbetrieb ui gestaltung entwicklung im Alltag klar verstehen und sauber umsetzen.",
          "correct": true,
          "explanation": "Das fasst die Kernidee von Ausbildungsbetrieb Ui Gestaltung Entwicklung direkt und handlungsnah zusammen."
        },
        {
          "id": "quiz01_v01_ausbildungsbetrieb_ui_gestaltung_entwicklung_kernidee_b",
          "text": "Wir können ausbildungsbetrieb ui gestaltung entwicklung ignorieren, solange es keinen Zeitdruck gibt.",
          "correct": false,
          "explanation": "Ausbildungsbetrieb Ui Gestaltung Entwicklung soll gerade nicht vertagt oder ausgesessen werden."
        },
        {
          "id": "quiz01_v01_ausbildungsbetrieb_ui_gestaltung_entwicklung_kernidee_c",
          "text": "Nur die Teamleitung darf sich überhaupt mit ausbildungsbetrieb ui gestaltung entwicklung befassen.",
          "correct": false,
          "explanation": "Die Aussage macht das Thema unnötig exklusiv und trifft die Lernidee nicht."
        },
        {
          "id": "quiz01_v01_ausbildungsbetrieb_ui_gestaltung_entwicklung_kernidee_d",
          "text": "Ausbildungsbetrieb Ui Gestaltung Entwicklung wird erst nach Projektende relevant.",
          "correct": false,
          "explanation": "Die Lernidee soll im laufenden Arbeitsalltag angewendet werden."
        }
      ]
    },
    {
      "id": "quiz01_v01_ausbildungsbetrieb_ui_gestaltung_entwicklung_praxisreaktion",
      "conceptId": "01_ausbildungsbetrieb_ui_gestaltung_entwicklung_praxisreaktion",
      "variantId": "quiz01_v01_ausbildungsbetrieb_ui_gestaltung_entwicklung_praxisreaktion",
      "isNew": false,
      "prompt": "Welche Reaktion passt im Ticket 01 am besten zu Ausbildungsbetrieb Ui Gestaltung Entwicklung?",
      "maxSelections": 1,
      "options": [
        {
          "id": "quiz01_v01_ausbildungsbetrieb_ui_gestaltung_entwicklung_praxis_a",
          "text": "Kurz abstimmen, sauber dokumentieren und den nächsten Schritt klar machen.",
          "correct": true,
          "explanation": "Das verbindet Rückfrage, Transparenz und handlungsfähige Umsetzung."
        },
        {
          "id": "quiz01_v01_ausbildungsbetrieb_ui_gestaltung_entwicklung_praxis_b",
          "text": "Erst einmal nichts notieren und später nach Gefühl entscheiden.",
          "correct": false,
          "explanation": "Gerade bei Ausbildungsbetrieb Ui Gestaltung Entwicklung wäre das unpräzise und riskant."
        },
        {
          "id": "quiz01_v01_ausbildungsbetrieb_ui_gestaltung_entwicklung_praxis_c",
          "text": "Probleme nur dann ansprechen, wenn sie bereits voll eskaliert sind.",
          "correct": false,
          "explanation": "Die richtige Richtung ist früh klären statt spät eskalieren."
        },
        {
          "id": "quiz01_v01_ausbildungsbetrieb_ui_gestaltung_entwicklung_praxis_d",
          "text": "Rückfragen vermeiden, auch wenn das Ziel noch unklar ist.",
          "correct": false,
          "explanation": "Die Lernidee verlangt gerade Klarheit und nicht stilles Raten."
        }
      ]
    }
  ]
}
