{
  "scenarioFolder": "Pruefungsvorbereitung-3-WISO-Scenarien",
  "quizFolder": "Pruefungsvorbereitung-3-WISO-Quiz",
  "scenarioFile": "ticket_ausbildungsbetrieb_wiso_ausbildung_mitbestimmung_markt_nachhaltigkeit/ticket08_V01_ausbildungsbetrieb_wiso_ausbildung_mitbestimmung_markt_nachhaltigkeit.json",
  "quizFile": "quiz_ausbildungsbetrieb_wiso_ausbildung_mitbestimmung_markt_nachhaltigkeit/quiz08_V01_ausbildungsbetrieb_wiso_ausbildung_mitbestimmung_markt_nachhaltigkeit.json",
  "ticketId": "08_easy_ausbildungsbetrieb_wiso_ausbildung_mitbestimmung_markt_nachhaltigkeit.json",
  "versionId": "V01",
  "title": "Ticket 08 - Ausbildung, Mitbestimmung, Markt und Nachhaltigkeit",
  "description": "Dummy-Daten für Ticket 08 - Ausbildung, Mitbestimmung, Markt und Nachhaltigkeit (V01) im DoomScrollQuiz.",
  "topics": [
    "Ausbildungsbetrieb Wiso Ausbildung Mitbestimmung Markt Nachhaltigkeit",
    "Version 01"
  ],
  "questions": [
    {
      "id": "quiz08_v01_ausbildungsbetrieb_wiso_ausbildung_mitbestimmung_markt_nachhaltigkeit_kernidee",
      "conceptId": "08_ausbildungsbetrieb_wiso_ausbildung_mitbestimmung_markt_nachhaltigkeit_kernidee",
      "variantId": "quiz08_v01_ausbildungsbetrieb_wiso_ausbildung_mitbestimmung_markt_nachhaltigkeit_kernidee",
      "isNew": true,
      "prompt": "Im Ticket 08 taucht die Fachaussage auf: \"Ausbildungsbetrieb Wiso Ausbildung Mitbestimmung Markt Nachhaltigkeit im Arbeitsalltag sicher einordnen und anwenden.\" Was hat er gesagt?",
      "maxSelections": 1,
      "options": [
        {
          "id": "quiz08_v01_ausbildungsbetrieb_wiso_ausbildung_mitbestimmung_markt_nachhaltigkeit_kernidee_a",
          "text": "Wir sollen ausbildungsbetrieb wiso ausbildung mitbestimmung markt nachhaltigkeit im Alltag klar verstehen und sauber umsetzen.",
          "correct": true,
          "explanation": "Das fasst die Kernidee von Ausbildungsbetrieb Wiso Ausbildung Mitbestimmung Markt Nachhaltigkeit direkt und handlungsnah zusammen."
        },
        {
          "id": "quiz08_v01_ausbildungsbetrieb_wiso_ausbildung_mitbestimmung_markt_nachhaltigkeit_kernidee_b",
          "text": "Wir können ausbildungsbetrieb wiso ausbildung mitbestimmung markt nachhaltigkeit ignorieren, solange es keinen Zeitdruck gibt.",
          "correct": false,
          "explanation": "Ausbildungsbetrieb Wiso Ausbildung Mitbestimmung Markt Nachhaltigkeit soll gerade nicht vertagt oder ausgesessen werden."
        },
        {
          "id": "quiz08_v01_ausbildungsbetrieb_wiso_ausbildung_mitbestimmung_markt_nachhaltigkeit_kernidee_c",
          "text": "Nur die Teamleitung darf sich überhaupt mit ausbildungsbetrieb wiso ausbildung mitbestimmung markt nachhaltigkeit befassen.",
          "correct": false,
          "explanation": "Die Aussage macht das Thema unnötig exklusiv und trifft die Lernidee nicht."
        },
        {
          "id": "quiz08_v01_ausbildungsbetrieb_wiso_ausbildung_mitbestimmung_markt_nachhaltigkeit_kernidee_d",
          "text": "Ausbildungsbetrieb Wiso Ausbildung Mitbestimmung Markt Nachhaltigkeit wird erst nach Projektende relevant.",
          "correct": false,
          "explanation": "Die Lernidee soll im laufenden Arbeitsalltag angewendet werden."
        }
      ]
    },
    {
      "id": "quiz08_v01_ausbildungsbetrieb_wiso_ausbildung_mitbestimmung_markt_nachhaltigkeit_praxisreaktion",
      "conceptId": "08_ausbildungsbetrieb_wiso_ausbildung_mitbestimmung_markt_nachhaltigkeit_praxisreaktion",
      "variantId": "quiz08_v01_ausbildungsbetrieb_wiso_ausbildung_mitbestimmung_markt_nachhaltigkeit_praxisreaktion",
      "isNew": false,
      "prompt": "Welche Reaktion passt im Ticket 08 am besten zu Ausbildungsbetrieb Wiso Ausbildung Mitbestimmung Markt Nachhaltigkeit?",
      "maxSelections": 1,
      "options": [
        {
          "id": "quiz08_v01_ausbildungsbetrieb_wiso_ausbildung_mitbestimmung_markt_nachhaltigkeit_praxis_a",
          "text": "Kurz abstimmen, sauber dokumentieren und den nächsten Schritt klar machen.",
          "correct": true,
          "explanation": "Das verbindet Rückfrage, Transparenz und handlungsfähige Umsetzung."
        },
        {
          "id": "quiz08_v01_ausbildungsbetrieb_wiso_ausbildung_mitbestimmung_markt_nachhaltigkeit_praxis_b",
          "text": "Erst einmal nichts notieren und später nach Gefühl entscheiden.",
          "correct": false,
          "explanation": "Gerade bei Ausbildungsbetrieb Wiso Ausbildung Mitbestimmung Markt Nachhaltigkeit wäre das unpräzise und riskant."
        },
        {
          "id": "quiz08_v01_ausbildungsbetrieb_wiso_ausbildung_mitbestimmung_markt_nachhaltigkeit_praxis_c",
          "text": "Probleme nur dann ansprechen, wenn sie bereits voll eskaliert sind.",
          "correct": false,
          "explanation": "Die richtige Richtung ist früh klären statt spät eskalieren."
        },
        {
          "id": "quiz08_v01_ausbildungsbetrieb_wiso_ausbildung_mitbestimmung_markt_nachhaltigkeit_praxis_d",
          "text": "Rückfragen vermeiden, auch wenn das Ziel noch unklar ist.",
          "correct": false,
          "explanation": "Die Lernidee verlangt gerade Klarheit und nicht stilles Raten."
        }
      ]
    }
  ]
}
