{
  "scenarioFolder": "LF02-Scenarien",
  "quizFolder": "LF02-Quiz",
  "scenarioFile": "ticket_ausbildungsbetrieb_abnahme_uebergabe/ticket08_V01_ausbildungsbetrieb_abnahme_uebergabe_en.json",
  "quizFile": "quiz_ausbildungsbetrieb_abnahme_uebergabe/quiz08_V01_ausbildungsbetrieb_abnahme_uebergabe_en.json",
  "ticketId": "08_easy_ausbildungsbetrieb_abnahme_uebergabe.json",
  "versionId": "V01",
  "title": "Ticket 08 - Acceptance & handover",
  "description": "Dummy data for Ticket 08 - Acceptance & handover (V01) in the DoomScrollQuiz.",
  "topics": [
    "Training company acceptance handover",
    "Version 01"
  ],
  "questions": [
    {
      "id": "quiz08_v01_ausbildungsbetrieb_abnahme_uebergabe_kernidee",
      "conceptId": "08_ausbildungsbetrieb_abnahme_uebergabe_kernidee",
      "variantId": "quiz08_v01_ausbildungsbetrieb_abnahme_uebergabe_kernidee",
      "isNew": true,
      "prompt": "In Ticket 08 the subject statement appears: \"Classify and apply training company acceptance and handover confidently in everyday work.\" What did he say?",
      "maxSelections": 1,
      "options": [
        {
          "id": "quiz08_v01_ausbildungsbetrieb_abnahme_uebergabe_kernidee_a",
          "text": "We should clearly understand training company acceptance and handover in everyday work and implement it properly.",
          "correct": true,
          "explanation": "This captures the core idea of training company acceptance and handover in a direct, actionable way."
        },
        {
          "id": "quiz08_v01_ausbildungsbetrieb_abnahme_uebergabe_kernidee_b",
          "text": "We can ignore training company acceptance and handover as long as there is no time pressure.",
          "correct": false,
          "explanation": "Training company acceptance and handover should not be postponed or avoided."
        },
        {
          "id": "quiz08_v01_ausbildungsbetrieb_abnahme_uebergabe_kernidee_c",
          "text": "Only team leads are allowed to deal with training company acceptance and handover.",
          "correct": false,
          "explanation": "That makes the topic unnecessarily exclusive and misses the learning intent."
        },
        {
          "id": "quiz08_v01_ausbildungsbetrieb_abnahme_uebergabe_kernidee_d",
          "text": "Training company acceptance and handover only becomes relevant after the project ends.",
          "correct": false,
          "explanation": "The learning idea is meant to be applied in day-to-day work."
        }
      ]
    },
    {
      "id": "quiz08_v01_ausbildungsbetrieb_abnahme_uebergabe_praxisreaktion",
      "conceptId": "08_ausbildungsbetrieb_abnahme_uebergabe_praxisreaktion",
      "variantId": "quiz08_v01_ausbildungsbetrieb_abnahme_uebergabe_praxisreaktion",
      "isNew": false,
      "prompt": "Which response fits Ticket 08 best for training company acceptance and handover?",
      "maxSelections": 1,
      "options": [
        {
          "id": "quiz08_v01_ausbildungsbetrieb_abnahme_uebergabe_praxis_a",
          "text": "Align briefly, document cleanly, and make the next step clear.",
          "correct": true,
          "explanation": "This combines clarification, transparency, and actionable execution."
        },
        {
          "id": "quiz08_v01_ausbildungsbetrieb_abnahme_uebergabe_praxis_b",
          "text": "Note nothing for now and decide later by gut feeling.",
          "correct": false,
          "explanation": "Especially for training company acceptance and handover, that would be imprecise and risky."
        },
        {
          "id": "quiz08_v01_ausbildungsbetrieb_abnahme_uebergabe_praxis_c",
          "text": "Only bring up issues once they have fully escalated.",
          "correct": false,
          "explanation": "The right approach is to clarify early instead of escalating late."
        },
        {
          "id": "quiz08_v01_ausbildungsbetrieb_abnahme_uebergabe_praxis_d",
          "text": "Avoid questions even when the goal is still unclear.",
          "correct": false,
          "explanation": "The learning intent calls for clarity, not silent guessing."
        }
      ]
    }
  ]
}
