{
  "scenarioFolder": "LF04-Scenarien",
  "quizFolder": "LF04-Quiz",
  "scenarioFile": "ticket_ausbildungsbetrieb_bedrohungen_social_engineering/ticket04_V01_ausbildungsbetrieb_bedrohungen_social_engineering.json",
  "quizFile": "quiz_ausbildungsbetrieb_bedrohungen_social_engineering/quiz04_V01_ausbildungsbetrieb_bedrohungen_social_engineering.json",
  "ticketId": "04_easy_ausbildungsbetrieb_bedrohungen_social_engineering.json",
  "versionId": "V01",
  "title": "Ticket 04 - Bedrohungen & Social Engineering",
  "description": "Dummy-Daten für Ticket 04 - Bedrohungen & Social Engineering (V01) im DoomScrollQuiz.",
  "topics": [
    "Ausbildungsbetrieb Bedrohungen Social Engineering",
    "Version 01"
  ],
  "questions": [
    {
      "id": "quiz04_v01_ausbildungsbetrieb_bedrohungen_social_engineering_kernidee",
      "conceptId": "04_ausbildungsbetrieb_bedrohungen_social_engineering_kernidee",
      "variantId": "quiz04_v01_ausbildungsbetrieb_bedrohungen_social_engineering_kernidee",
      "isNew": true,
      "prompt": "Im Ticket 04 taucht die Fachaussage auf: \"Ausbildungsbetrieb Bedrohungen Social Engineering im Arbeitsalltag sicher einordnen und anwenden.\" Was hat er gesagt?",
      "maxSelections": 1,
      "options": [
        {
          "id": "quiz04_v01_ausbildungsbetrieb_bedrohungen_social_engineering_kernidee_a",
          "text": "Wir sollen ausbildungsbetrieb bedrohungen social engineering im Alltag klar verstehen und sauber umsetzen.",
          "correct": true,
          "explanation": "Das fasst die Kernidee von Ausbildungsbetrieb Bedrohungen Social Engineering direkt und handlungsnah zusammen."
        },
        {
          "id": "quiz04_v01_ausbildungsbetrieb_bedrohungen_social_engineering_kernidee_b",
          "text": "Wir können ausbildungsbetrieb bedrohungen social engineering ignorieren, solange es keinen Zeitdruck gibt.",
          "correct": false,
          "explanation": "Ausbildungsbetrieb Bedrohungen Social Engineering soll gerade nicht vertagt oder ausgesessen werden."
        },
        {
          "id": "quiz04_v01_ausbildungsbetrieb_bedrohungen_social_engineering_kernidee_c",
          "text": "Nur die Teamleitung darf sich überhaupt mit ausbildungsbetrieb bedrohungen social engineering befassen.",
          "correct": false,
          "explanation": "Die Aussage macht das Thema unnötig exklusiv und trifft die Lernidee nicht."
        },
        {
          "id": "quiz04_v01_ausbildungsbetrieb_bedrohungen_social_engineering_kernidee_d",
          "text": "Ausbildungsbetrieb Bedrohungen Social Engineering wird erst nach Projektende relevant.",
          "correct": false,
          "explanation": "Die Lernidee soll im laufenden Arbeitsalltag angewendet werden."
        }
      ]
    },
    {
      "id": "quiz04_v01_ausbildungsbetrieb_bedrohungen_social_engineering_praxisreaktion",
      "conceptId": "04_ausbildungsbetrieb_bedrohungen_social_engineering_praxisreaktion",
      "variantId": "quiz04_v01_ausbildungsbetrieb_bedrohungen_social_engineering_praxisreaktion",
      "isNew": false,
      "prompt": "Welche Reaktion passt im Ticket 04 am besten zu Ausbildungsbetrieb Bedrohungen Social Engineering?",
      "maxSelections": 1,
      "options": [
        {
          "id": "quiz04_v01_ausbildungsbetrieb_bedrohungen_social_engineering_praxis_a",
          "text": "Kurz abstimmen, sauber dokumentieren und den nächsten Schritt klar machen.",
          "correct": true,
          "explanation": "Das verbindet Rückfrage, Transparenz und handlungsfähige Umsetzung."
        },
        {
          "id": "quiz04_v01_ausbildungsbetrieb_bedrohungen_social_engineering_praxis_b",
          "text": "Erst einmal nichts notieren und später nach Gefühl entscheiden.",
          "correct": false,
          "explanation": "Gerade bei Ausbildungsbetrieb Bedrohungen Social Engineering wäre das unpräzise und riskant."
        },
        {
          "id": "quiz04_v01_ausbildungsbetrieb_bedrohungen_social_engineering_praxis_c",
          "text": "Probleme nur dann ansprechen, wenn sie bereits voll eskaliert sind.",
          "correct": false,
          "explanation": "Die richtige Richtung ist früh klären statt spät eskalieren."
        },
        {
          "id": "quiz04_v01_ausbildungsbetrieb_bedrohungen_social_engineering_praxis_d",
          "text": "Rückfragen vermeiden, auch wenn das Ziel noch unklar ist.",
          "correct": false,
          "explanation": "Die Lernidee verlangt gerade Klarheit und nicht stilles Raten."
        }
      ]
    }
  ]
}
