{
  "scenarioFolder": "LF04-Scenarien",
  "quizFolder": "LF04-Quiz",
  "scenarioFile": "ticket_ausbildungsbetrieb_schutzbedarf_clients/ticket06_V01_ausbildungsbetrieb_schutzbedarf_clients_en.json",
  "quizFile": "quiz_ausbildungsbetrieb_schutzbedarf_clients/quiz06_V01_ausbildungsbetrieb_schutzbedarf_clients_en.json",
  "ticketId": "06_easy_ausbildungsbetrieb_schutzbedarf_clients.json",
  "versionId": "V01",
  "title": "Ticket 06 - Workstation protection need",
  "description": "Dummy data for ticket 06 - Workstation protection need (V01) in the DoomScrollQuiz.",
  "topics": [
    "Training company workstation protection need",
    "Version 01"
  ],
  "questions": [
    {
      "id": "quiz06_v01_ausbildungsbetrieb_schutzbedarf_clients_kernidee",
      "conceptId": "06_ausbildungsbetrieb_schutzbedarf_clients_kernidee",
      "variantId": "quiz06_v01_ausbildungsbetrieb_schutzbedarf_clients_kernidee",
      "isNew": true,
      "prompt": "In ticket 06 the key statement appears: \"Classify and apply the training company's workstation protection need safely in daily work.\" What did he say?",
      "maxSelections": 1,
      "options": [
        {
          "id": "quiz06_v01_ausbildungsbetrieb_schutzbedarf_clients_kernidee_a",
          "text": "We should clearly understand the workstation protection need in the training company and implement it cleanly in daily work.",
          "correct": true,
          "explanation": "This summarizes the core idea of the training company's workstation protection need in a direct, practical way."
        },
        {
          "id": "quiz06_v01_ausbildungsbetrieb_schutzbedarf_clients_kernidee_b",
          "text": "We can ignore the workstation protection need in the training company as long as there is no time pressure.",
          "correct": false,
          "explanation": "The workstation protection need in the training company should not be postponed or sat out."
        },
        {
          "id": "quiz06_v01_ausbildungsbetrieb_schutzbedarf_clients_kernidee_c",
          "text": "Only the team lead is allowed to deal with the workstation protection need in the training company.",
          "correct": false,
          "explanation": "This makes the topic unnecessarily exclusive and misses the learning idea."
        },
        {
          "id": "quiz06_v01_ausbildungsbetrieb_schutzbedarf_clients_kernidee_d",
          "text": "The workstation protection need in the training company only becomes relevant after the project ends.",
          "correct": false,
          "explanation": "The learning idea should be applied during ongoing daily work."
        }
      ]
    },
    {
      "id": "quiz06_v01_ausbildungsbetrieb_schutzbedarf_clients_praxisreaktion",
      "conceptId": "06_ausbildungsbetrieb_schutzbedarf_clients_praxisreaktion",
      "variantId": "quiz06_v01_ausbildungsbetrieb_schutzbedarf_clients_praxisreaktion",
      "isNew": false,
      "prompt": "Which reaction best fits ticket 06 regarding the training company's workstation protection need?",
      "maxSelections": 1,
      "options": [
        {
          "id": "quiz06_v01_ausbildungsbetrieb_schutzbedarf_clients_praxis_a",
          "text": "Align briefly, document cleanly, and make the next step clear.",
          "correct": true,
          "explanation": "This combines clarification, transparency, and actionable implementation."
        },
        {
          "id": "quiz06_v01_ausbildungsbetrieb_schutzbedarf_clients_praxis_b",
          "text": "Write nothing down at first and decide later by feel.",
          "correct": false,
          "explanation": "For the training company's workstation protection need this would be imprecise and risky."
        },
        {
          "id": "quiz06_v01_ausbildungsbetrieb_schutzbedarf_clients_praxis_c",
          "text": "Only raise problems once they are fully escalated.",
          "correct": false,
          "explanation": "The right direction is to clarify early instead of escalating late."
        },
        {
          "id": "quiz06_v01_ausbildungsbetrieb_schutzbedarf_clients_praxis_d",
          "text": "Avoid questions even if the goal is still unclear.",
          "correct": false,
          "explanation": "The learning idea requires clarity, not silent guessing."
        }
      ]
    }
  ]
}
