{
  "scenarioFolder": "QuS2-Scenarien",
  "quizFolder": "QuS2-Quiz",
  "scenarioFile": "ticket_ausbildungsbetrieb_aufbewahrung_bereinigung_nachweise/ticket04_V01_ausbildungsbetrieb_aufbewahrung_bereinigung_nachweise.json",
  "quizFile": "quiz_ausbildungsbetrieb_aufbewahrung_bereinigung_nachweise/quiz04_V01_ausbildungsbetrieb_aufbewahrung_bereinigung_nachweise.json",
  "ticketId": "04_easy_ausbildungsbetrieb_aufbewahrung_bereinigung_nachweise.json",
  "versionId": "V01",
  "title": "Ticket 04 - Aufbewahrung, Bereinigung und Nachweise",
  "description": "Dummy-Daten für Ticket 04 - Aufbewahrung, Bereinigung und Nachweise (V01) im DoomScrollQuiz.",
  "topics": [
    "Ausbildungsbetrieb Aufbewahrung Bereinigung Nachweise",
    "Version 01"
  ],
  "questions": [
    {
      "id": "quiz04_v01_ausbildungsbetrieb_aufbewahrung_bereinigung_nachweise_kernidee",
      "conceptId": "04_ausbildungsbetrieb_aufbewahrung_bereinigung_nachweise_kernidee",
      "variantId": "quiz04_v01_ausbildungsbetrieb_aufbewahrung_bereinigung_nachweise_kernidee",
      "isNew": true,
      "prompt": "Im Ticket 04 taucht die Fachaussage auf: \"Ausbildungsbetrieb Aufbewahrung Bereinigung Nachweise im Arbeitsalltag sicher einordnen und anwenden.\" Was hat er gesagt?",
      "maxSelections": 1,
      "options": [
        {
          "id": "quiz04_v01_ausbildungsbetrieb_aufbewahrung_bereinigung_nachweise_kernidee_a",
          "text": "Wir sollen ausbildungsbetrieb aufbewahrung bereinigung nachweise im Alltag klar verstehen und sauber umsetzen.",
          "correct": true,
          "explanation": "Das fasst die Kernidee von Ausbildungsbetrieb Aufbewahrung Bereinigung Nachweise direkt und handlungsnah zusammen."
        },
        {
          "id": "quiz04_v01_ausbildungsbetrieb_aufbewahrung_bereinigung_nachweise_kernidee_b",
          "text": "Wir können ausbildungsbetrieb aufbewahrung bereinigung nachweise ignorieren, solange es keinen Zeitdruck gibt.",
          "correct": false,
          "explanation": "Ausbildungsbetrieb Aufbewahrung Bereinigung Nachweise soll gerade nicht vertagt oder ausgesessen werden."
        },
        {
          "id": "quiz04_v01_ausbildungsbetrieb_aufbewahrung_bereinigung_nachweise_kernidee_c",
          "text": "Nur die Teamleitung darf sich überhaupt mit ausbildungsbetrieb aufbewahrung bereinigung nachweise befassen.",
          "correct": false,
          "explanation": "Die Aussage macht das Thema unnötig exklusiv und trifft die Lernidee nicht."
        },
        {
          "id": "quiz04_v01_ausbildungsbetrieb_aufbewahrung_bereinigung_nachweise_kernidee_d",
          "text": "Ausbildungsbetrieb Aufbewahrung Bereinigung Nachweise wird erst nach Projektende relevant.",
          "correct": false,
          "explanation": "Die Lernidee soll im laufenden Arbeitsalltag angewendet werden."
        }
      ]
    },
    {
      "id": "quiz04_v01_ausbildungsbetrieb_aufbewahrung_bereinigung_nachweise_praxisreaktion",
      "conceptId": "04_ausbildungsbetrieb_aufbewahrung_bereinigung_nachweise_praxisreaktion",
      "variantId": "quiz04_v01_ausbildungsbetrieb_aufbewahrung_bereinigung_nachweise_praxisreaktion",
      "isNew": false,
      "prompt": "Welche Reaktion passt im Ticket 04 am besten zu Ausbildungsbetrieb Aufbewahrung Bereinigung Nachweise?",
      "maxSelections": 1,
      "options": [
        {
          "id": "quiz04_v01_ausbildungsbetrieb_aufbewahrung_bereinigung_nachweise_praxis_a",
          "text": "Kurz abstimmen, sauber dokumentieren und den nächsten Schritt klar machen.",
          "correct": true,
          "explanation": "Das verbindet Rückfrage, Transparenz und handlungsfähige Umsetzung."
        },
        {
          "id": "quiz04_v01_ausbildungsbetrieb_aufbewahrung_bereinigung_nachweise_praxis_b",
          "text": "Erst einmal nichts notieren und später nach Gefühl entscheiden.",
          "correct": false,
          "explanation": "Gerade bei Ausbildungsbetrieb Aufbewahrung Bereinigung Nachweise wäre das unpräzise und riskant."
        },
        {
          "id": "quiz04_v01_ausbildungsbetrieb_aufbewahrung_bereinigung_nachweise_praxis_c",
          "text": "Probleme nur dann ansprechen, wenn sie bereits voll eskaliert sind.",
          "correct": false,
          "explanation": "Die richtige Richtung ist früh klären statt spät eskalieren."
        },
        {
          "id": "quiz04_v01_ausbildungsbetrieb_aufbewahrung_bereinigung_nachweise_praxis_d",
          "text": "Rückfragen vermeiden, auch wenn das Ziel noch unklar ist.",
          "correct": false,
          "explanation": "Die Lernidee verlangt gerade Klarheit und nicht stilles Raten."
        }
      ]
    }
  ]
}
