{
  "scenarioFolder": "LF01-Scenarien",
  "quizFolder": "LF01-Quiz",
  "scenarioFile": "ticket_ausbildungsbetrieb_rechte_pflichten_mitbestimmung/ticket02_V01_ausbildungsbetrieb_rechte_pflichten_mitbestimmung.json",
  "quizFile": "quiz_ausbildungsbetrieb_rechte_pflichten_mitbestimmung/quiz02_V01_ausbildungsbetrieb_rechte_pflichten_mitbestimmung.json",
  "ticketId": "02_easy_ausbildungsbetrieb_rechte_pflichten_mitbestimmung.json",
  "versionId": "V01",
  "title": "Ticket 02 - Rechte & Pflichten",
  "description": "Dummy-Daten fuer Ticket 02 - Rechte & Pflichten (V01) im DoomScrollQuiz.",
  "topics": [
    "Ausbildungsbetrieb Rechte Pflichten Mitbestimmung",
    "Version 01"
  ],
  "questions": [
    {
      "id": "quiz02_v01_ausbildungsbetrieb_rechte_pflichten_mitbestimmung_kernidee",
      "conceptId": "02_ausbildungsbetrieb_rechte_pflichten_mitbestimmung_kernidee",
      "variantId": "quiz02_v01_ausbildungsbetrieb_rechte_pflichten_mitbestimmung_kernidee",
      "isNew": true,
      "prompt": "Im Ticket 02 taucht die Fachaussage auf: \"Ausbildungsbetrieb Rechte Pflichten Mitbestimmung im Arbeitsalltag sicher einordnen und anwenden.\" Was hat er gesagt?",
      "maxSelections": 1,
      "options": [
        {
          "id": "quiz02_v01_ausbildungsbetrieb_rechte_pflichten_mitbestimmung_kernidee_a",
          "text": "Wir sollen ausbildungsbetrieb rechte pflichten mitbestimmung im Alltag klar verstehen und sauber umsetzen.",
          "correct": true,
          "explanation": "Das fasst die Kernidee von Ausbildungsbetrieb Rechte Pflichten Mitbestimmung direkt und handlungsnah zusammen."
        },
        {
          "id": "quiz02_v01_ausbildungsbetrieb_rechte_pflichten_mitbestimmung_kernidee_b",
          "text": "Wir koennen ausbildungsbetrieb rechte pflichten mitbestimmung ignorieren, solange es keinen Zeitdruck gibt.",
          "correct": false,
          "explanation": "Ausbildungsbetrieb Rechte Pflichten Mitbestimmung soll gerade nicht vertagt oder ausgesessen werden."
        },
        {
          "id": "quiz02_v01_ausbildungsbetrieb_rechte_pflichten_mitbestimmung_kernidee_c",
          "text": "Nur die Teamleitung darf sich ueberhaupt mit ausbildungsbetrieb rechte pflichten mitbestimmung befassen.",
          "correct": false,
          "explanation": "Die Aussage macht das Thema unnoetig exklusiv und trifft die Lernidee nicht."
        },
        {
          "id": "quiz02_v01_ausbildungsbetrieb_rechte_pflichten_mitbestimmung_kernidee_d",
          "text": "Ausbildungsbetrieb Rechte Pflichten Mitbestimmung wird erst nach Projektende relevant.",
          "correct": false,
          "explanation": "Die Lernidee soll im laufenden Arbeitsalltag angewendet werden."
        }
      ]
    },
    {
      "id": "quiz02_v01_ausbildungsbetrieb_rechte_pflichten_mitbestimmung_praxisreaktion",
      "conceptId": "02_ausbildungsbetrieb_rechte_pflichten_mitbestimmung_praxisreaktion",
      "variantId": "quiz02_v01_ausbildungsbetrieb_rechte_pflichten_mitbestimmung_praxisreaktion",
      "isNew": false,
      "prompt": "Welche Reaktion passt im Ticket 02 am besten zu Ausbildungsbetrieb Rechte Pflichten Mitbestimmung?",
      "maxSelections": 1,
      "options": [
        {
          "id": "quiz02_v01_ausbildungsbetrieb_rechte_pflichten_mitbestimmung_praxis_a",
          "text": "Kurz abstimmen, sauber dokumentieren und den naechsten Schritt klar machen.",
          "correct": true,
          "explanation": "Das verbindet Rueckfrage, Transparenz und handlungsfaehige Umsetzung."
        },
        {
          "id": "quiz02_v01_ausbildungsbetrieb_rechte_pflichten_mitbestimmung_praxis_b",
          "text": "Erst einmal nichts notieren und spaeter nach Gefuehl entscheiden.",
          "correct": false,
          "explanation": "Gerade bei Ausbildungsbetrieb Rechte Pflichten Mitbestimmung waere das unpraezise und riskant."
        },
        {
          "id": "quiz02_v01_ausbildungsbetrieb_rechte_pflichten_mitbestimmung_praxis_c",
          "text": "Probleme nur dann ansprechen, wenn sie bereits voll eskaliert sind.",
          "correct": false,
          "explanation": "Die richtige Richtung ist frueh klaeren statt spaet eskalieren."
        },
        {
          "id": "quiz02_v01_ausbildungsbetrieb_rechte_pflichten_mitbestimmung_praxis_d",
          "text": "Rueckfragen vermeiden, auch wenn das Ziel noch unklar ist.",
          "correct": false,
          "explanation": "Die Lernidee verlangt gerade Klarheit und nicht stilles Raten."
        }
      ]
    }
  ]
}
