{
  "scenarioFolder": "QuS2-Scenarien",
  "quizFolder": "QuS2-Quiz",
  "scenarioFile": "ticket_ausbildungsbetrieb_berechtigungsreview_rollen_altkonten/ticket06_V01_ausbildungsbetrieb_berechtigungsreview_rollen_altkonten.json",
  "quizFile": "quiz_ausbildungsbetrieb_berechtigungsreview_rollen_altkonten/quiz06_V01_ausbildungsbetrieb_berechtigungsreview_rollen_altkonten.json",
  "ticketId": "06_easy_ausbildungsbetrieb_berechtigungsreview_rollen_altkonten.json",
  "versionId": "V01",
  "title": "Ticket 06 - Berechtigungsreview, Rollenwechsel und Altkonten",
  "description": "Dummy-Daten fuer Ticket 06 - Berechtigungsreview, Rollenwechsel und Altkonten (V01) im DoomScrollQuiz.",
  "topics": [
    "Ausbildungsbetrieb Berechtigungsreview Rollen Altkonten",
    "Version 01"
  ],
  "questions": [
    {
      "id": "quiz06_v01_ausbildungsbetrieb_berechtigungsreview_rollen_altkonten_kernidee",
      "conceptId": "06_ausbildungsbetrieb_berechtigungsreview_rollen_altkonten_kernidee",
      "variantId": "quiz06_v01_ausbildungsbetrieb_berechtigungsreview_rollen_altkonten_kernidee",
      "isNew": true,
      "prompt": "Im Ticket 06 taucht die Fachaussage auf: \"Ausbildungsbetrieb Berechtigungsreview Rollen Altkonten im Arbeitsalltag sicher einordnen und anwenden.\" Was hat er gesagt?",
      "maxSelections": 1,
      "options": [
        {
          "id": "quiz06_v01_ausbildungsbetrieb_berechtigungsreview_rollen_altkonten_kernidee_a",
          "text": "Wir sollen ausbildungsbetrieb berechtigungsreview rollen altkonten im Alltag klar verstehen und sauber umsetzen.",
          "correct": true,
          "explanation": "Das fasst die Kernidee von Ausbildungsbetrieb Berechtigungsreview Rollen Altkonten direkt und handlungsnah zusammen."
        },
        {
          "id": "quiz06_v01_ausbildungsbetrieb_berechtigungsreview_rollen_altkonten_kernidee_b",
          "text": "Wir koennen ausbildungsbetrieb berechtigungsreview rollen altkonten ignorieren, solange es keinen Zeitdruck gibt.",
          "correct": false,
          "explanation": "Ausbildungsbetrieb Berechtigungsreview Rollen Altkonten soll gerade nicht vertagt oder ausgesessen werden."
        },
        {
          "id": "quiz06_v01_ausbildungsbetrieb_berechtigungsreview_rollen_altkonten_kernidee_c",
          "text": "Nur die Teamleitung darf sich ueberhaupt mit ausbildungsbetrieb berechtigungsreview rollen altkonten befassen.",
          "correct": false,
          "explanation": "Die Aussage macht das Thema unnoetig exklusiv und trifft die Lernidee nicht."
        },
        {
          "id": "quiz06_v01_ausbildungsbetrieb_berechtigungsreview_rollen_altkonten_kernidee_d",
          "text": "Ausbildungsbetrieb Berechtigungsreview Rollen Altkonten wird erst nach Projektende relevant.",
          "correct": false,
          "explanation": "Die Lernidee soll im laufenden Arbeitsalltag angewendet werden."
        }
      ]
    },
    {
      "id": "quiz06_v01_ausbildungsbetrieb_berechtigungsreview_rollen_altkonten_praxisreaktion",
      "conceptId": "06_ausbildungsbetrieb_berechtigungsreview_rollen_altkonten_praxisreaktion",
      "variantId": "quiz06_v01_ausbildungsbetrieb_berechtigungsreview_rollen_altkonten_praxisreaktion",
      "isNew": false,
      "prompt": "Welche Reaktion passt im Ticket 06 am besten zu Ausbildungsbetrieb Berechtigungsreview Rollen Altkonten?",
      "maxSelections": 1,
      "options": [
        {
          "id": "quiz06_v01_ausbildungsbetrieb_berechtigungsreview_rollen_altkonten_praxis_a",
          "text": "Kurz abstimmen, sauber dokumentieren und den naechsten Schritt klar machen.",
          "correct": true,
          "explanation": "Das verbindet Rueckfrage, Transparenz und handlungsfaehige Umsetzung."
        },
        {
          "id": "quiz06_v01_ausbildungsbetrieb_berechtigungsreview_rollen_altkonten_praxis_b",
          "text": "Erst einmal nichts notieren und spaeter nach Gefuehl entscheiden.",
          "correct": false,
          "explanation": "Gerade bei Ausbildungsbetrieb Berechtigungsreview Rollen Altkonten waere das unpraezise und riskant."
        },
        {
          "id": "quiz06_v01_ausbildungsbetrieb_berechtigungsreview_rollen_altkonten_praxis_c",
          "text": "Probleme nur dann ansprechen, wenn sie bereits voll eskaliert sind.",
          "correct": false,
          "explanation": "Die richtige Richtung ist frueh klaeren statt spaet eskalieren."
        },
        {
          "id": "quiz06_v01_ausbildungsbetrieb_berechtigungsreview_rollen_altkonten_praxis_d",
          "text": "Rueckfragen vermeiden, auch wenn das Ziel noch unklar ist.",
          "correct": false,
          "explanation": "Die Lernidee verlangt gerade Klarheit und nicht stilles Raten."
        }
      ]
    }
  ]
}
