{
  "scenarioFolder": "LF04-Scenarien",
  "quizFolder": "LF04-Quiz",
  "scenarioFile": "ticket_ausbildungsbetrieb_infosicherheit_rollen/ticket02_V01_ausbildungsbetrieb_infosicherheit_rollen.json",
  "quizFile": "quiz_ausbildungsbetrieb_infosicherheit_rollen/quiz02_V01_ausbildungsbetrieb_infosicherheit_rollen.json",
  "ticketId": "02_easy_ausbildungsbetrieb_infosicherheit_rollen.json",
  "versionId": "V01",
  "title": "Ticket 02 - Informationssicherheit & Rollen",
  "description": "Dummy-Daten für Ticket 02 - Informationssicherheit & Rollen (V01) im DoomScrollQuiz.",
  "topics": [
    "Ausbildungsbetrieb Infosicherheit Rollen",
    "Version 01"
  ],
  "questions": [
    {
      "id": "quiz02_v01_ausbildungsbetrieb_infosicherheit_rollen_kernidee",
      "conceptId": "02_ausbildungsbetrieb_infosicherheit_rollen_kernidee",
      "variantId": "quiz02_v01_ausbildungsbetrieb_infosicherheit_rollen_kernidee",
      "isNew": true,
      "prompt": "Im Ticket 02 taucht die Fachaussage auf: \"Ausbildungsbetrieb Infosicherheit Rollen im Arbeitsalltag sicher einordnen und anwenden.\" Was hat er gesagt?",
      "maxSelections": 1,
      "options": [
        {
          "id": "quiz02_v01_ausbildungsbetrieb_infosicherheit_rollen_kernidee_a",
          "text": "Wir sollen ausbildungsbetrieb infosicherheit rollen im Alltag klar verstehen und sauber umsetzen.",
          "correct": true,
          "explanation": "Das fasst die Kernidee von Ausbildungsbetrieb Infosicherheit Rollen direkt und handlungsnah zusammen."
        },
        {
          "id": "quiz02_v01_ausbildungsbetrieb_infosicherheit_rollen_kernidee_b",
          "text": "Wir können ausbildungsbetrieb infosicherheit rollen ignorieren, solange es keinen Zeitdruck gibt.",
          "correct": false,
          "explanation": "Ausbildungsbetrieb Infosicherheit Rollen soll gerade nicht vertagt oder ausgesessen werden."
        },
        {
          "id": "quiz02_v01_ausbildungsbetrieb_infosicherheit_rollen_kernidee_c",
          "text": "Nur die Teamleitung darf sich überhaupt mit ausbildungsbetrieb infosicherheit rollen befassen.",
          "correct": false,
          "explanation": "Die Aussage macht das Thema unnötig exklusiv und trifft die Lernidee nicht."
        },
        {
          "id": "quiz02_v01_ausbildungsbetrieb_infosicherheit_rollen_kernidee_d",
          "text": "Ausbildungsbetrieb Infosicherheit Rollen wird erst nach Projektende relevant.",
          "correct": false,
          "explanation": "Die Lernidee soll im laufenden Arbeitsalltag angewendet werden."
        }
      ]
    },
    {
      "id": "quiz02_v01_ausbildungsbetrieb_infosicherheit_rollen_praxisreaktion",
      "conceptId": "02_ausbildungsbetrieb_infosicherheit_rollen_praxisreaktion",
      "variantId": "quiz02_v01_ausbildungsbetrieb_infosicherheit_rollen_praxisreaktion",
      "isNew": false,
      "prompt": "Welche Reaktion passt im Ticket 02 am besten zu Ausbildungsbetrieb Infosicherheit Rollen?",
      "maxSelections": 1,
      "options": [
        {
          "id": "quiz02_v01_ausbildungsbetrieb_infosicherheit_rollen_praxis_a",
          "text": "Kurz abstimmen, sauber dokumentieren und den nächsten Schritt klar machen.",
          "correct": true,
          "explanation": "Das verbindet Rückfrage, Transparenz und handlungsfähige Umsetzung."
        },
        {
          "id": "quiz02_v01_ausbildungsbetrieb_infosicherheit_rollen_praxis_b",
          "text": "Erst einmal nichts notieren und später nach Gefühl entscheiden.",
          "correct": false,
          "explanation": "Gerade bei Ausbildungsbetrieb Infosicherheit Rollen wäre das unpräzise und riskant."
        },
        {
          "id": "quiz02_v01_ausbildungsbetrieb_infosicherheit_rollen_praxis_c",
          "text": "Probleme nur dann ansprechen, wenn sie bereits voll eskaliert sind.",
          "correct": false,
          "explanation": "Die richtige Richtung ist früh klären statt spät eskalieren."
        },
        {
          "id": "quiz02_v01_ausbildungsbetrieb_infosicherheit_rollen_praxis_d",
          "text": "Rückfragen vermeiden, auch wenn das Ziel noch unklar ist.",
          "correct": false,
          "explanation": "Die Lernidee verlangt gerade Klarheit und nicht stilles Raten."
        }
      ]
    }
  ]
}
