{
  "scenarioFolder": "LF08-Scenarien",
  "quizFolder": "LF08-Quiz",
  "scenarioFile": "ticket_ausbildungsbetrieb_datenintegration_serviceportal/ticket01_V01_ausbildungsbetrieb_datenintegration_serviceportal.json",
  "quizFile": "quiz_ausbildungsbetrieb_datenintegration_serviceportal/quiz01_V01_ausbildungsbetrieb_datenintegration_serviceportal.json",
  "ticketId": "01_easy_ausbildungsbetrieb_datenintegration_serviceportal.json",
  "versionId": "V01",
  "title": "Ticket 01 - Datenintegration Serviceportal",
  "description": "Dummy-Daten fuer Ticket 01 - Datenintegration Serviceportal (V01) im DoomScrollQuiz.",
  "topics": [
    "Ausbildungsbetrieb Datenintegration Serviceportal",
    "Version 01"
  ],
  "questions": [
    {
      "id": "quiz01_v01_ausbildungsbetrieb_datenintegration_serviceportal_kernidee",
      "conceptId": "01_ausbildungsbetrieb_datenintegration_serviceportal_kernidee",
      "variantId": "quiz01_v01_ausbildungsbetrieb_datenintegration_serviceportal_kernidee",
      "isNew": true,
      "prompt": "Im Ticket 01 taucht die Fachaussage auf: \"Ausbildungsbetrieb Datenintegration Serviceportal im Arbeitsalltag sicher einordnen und anwenden.\" Was hat er gesagt?",
      "maxSelections": 1,
      "options": [
        {
          "id": "quiz01_v01_ausbildungsbetrieb_datenintegration_serviceportal_kernidee_a",
          "text": "Wir sollen ausbildungsbetrieb datenintegration serviceportal im Alltag klar verstehen und sauber umsetzen.",
          "correct": true,
          "explanation": "Das fasst die Kernidee von Ausbildungsbetrieb Datenintegration Serviceportal direkt und handlungsnah zusammen."
        },
        {
          "id": "quiz01_v01_ausbildungsbetrieb_datenintegration_serviceportal_kernidee_b",
          "text": "Wir koennen ausbildungsbetrieb datenintegration serviceportal ignorieren, solange es keinen Zeitdruck gibt.",
          "correct": false,
          "explanation": "Ausbildungsbetrieb Datenintegration Serviceportal soll gerade nicht vertagt oder ausgesessen werden."
        },
        {
          "id": "quiz01_v01_ausbildungsbetrieb_datenintegration_serviceportal_kernidee_c",
          "text": "Nur die Teamleitung darf sich ueberhaupt mit ausbildungsbetrieb datenintegration serviceportal befassen.",
          "correct": false,
          "explanation": "Die Aussage macht das Thema unnoetig exklusiv und trifft die Lernidee nicht."
        },
        {
          "id": "quiz01_v01_ausbildungsbetrieb_datenintegration_serviceportal_kernidee_d",
          "text": "Ausbildungsbetrieb Datenintegration Serviceportal wird erst nach Projektende relevant.",
          "correct": false,
          "explanation": "Die Lernidee soll im laufenden Arbeitsalltag angewendet werden."
        }
      ]
    },
    {
      "id": "quiz01_v01_ausbildungsbetrieb_datenintegration_serviceportal_praxisreaktion",
      "conceptId": "01_ausbildungsbetrieb_datenintegration_serviceportal_praxisreaktion",
      "variantId": "quiz01_v01_ausbildungsbetrieb_datenintegration_serviceportal_praxisreaktion",
      "isNew": false,
      "prompt": "Welche Reaktion passt im Ticket 01 am besten zu Ausbildungsbetrieb Datenintegration Serviceportal?",
      "maxSelections": 1,
      "options": [
        {
          "id": "quiz01_v01_ausbildungsbetrieb_datenintegration_serviceportal_praxis_a",
          "text": "Kurz abstimmen, sauber dokumentieren und den naechsten Schritt klar machen.",
          "correct": true,
          "explanation": "Das verbindet Rueckfrage, Transparenz und handlungsfaehige Umsetzung."
        },
        {
          "id": "quiz01_v01_ausbildungsbetrieb_datenintegration_serviceportal_praxis_b",
          "text": "Erst einmal nichts notieren und spaeter nach Gefuehl entscheiden.",
          "correct": false,
          "explanation": "Gerade bei Ausbildungsbetrieb Datenintegration Serviceportal waere das unpraezise und riskant."
        },
        {
          "id": "quiz01_v01_ausbildungsbetrieb_datenintegration_serviceportal_praxis_c",
          "text": "Probleme nur dann ansprechen, wenn sie bereits voll eskaliert sind.",
          "correct": false,
          "explanation": "Die richtige Richtung ist frueh klaeren statt spaet eskalieren."
        },
        {
          "id": "quiz01_v01_ausbildungsbetrieb_datenintegration_serviceportal_praxis_d",
          "text": "Rueckfragen vermeiden, auch wenn das Ziel noch unklar ist.",
          "correct": false,
          "explanation": "Die Lernidee verlangt gerade Klarheit und nicht stilles Raten."
        }
      ]
    }
  ]
}
