{
  "scenarioFolder": "QuS2-Scenarien",
  "quizFolder": "QuS2-Quiz",
  "scenarioFile": "ticket_ausbildungsbetrieb_exportfehler_meldeweg_schutzmassnahmen/ticket02_V01_ausbildungsbetrieb_exportfehler_meldeweg_schutzmassnahmen_en.json",
  "quizFile": "quiz_ausbildungsbetrieb_exportfehler_meldeweg_schutzmassnahmen/quiz02_V01_ausbildungsbetrieb_exportfehler_meldeweg_schutzmassnahmen_en.json",
  "ticketId": "02_easy_ausbildungsbetrieb_exportfehler_meldeweg_schutzmassnahmen.json",
  "versionId": "V01",
  "title": "Ticket 02 - Export error, reporting path and safeguards",
  "description": "Dummy data for Ticket 02 - export error, reporting path and safeguards (V01) in the DoomScrollQuiz.",
  "topics": [
    "Training operations export error reporting path safeguards",
    "Version 01"
  ],
  "questions": [
    {
      "id": "quiz02_v01_ausbildungsbetrieb_exportfehler_meldeweg_schutzmassnahmen_kernidee",
      "conceptId": "02_ausbildungsbetrieb_exportfehler_meldeweg_schutzmassnahmen_kernidee",
      "variantId": "quiz02_v01_ausbildungsbetrieb_exportfehler_meldeweg_schutzmassnahmen_kernidee",
      "isNew": true,
      "prompt": "In Ticket 02 the expert statement appears: \"Classify and apply export error, reporting path and safeguards reliably in daily operations.\" What did he say?",
      "maxSelections": 1,
      "options": [
        {
          "id": "quiz02_v01_ausbildungsbetrieb_exportfehler_meldeweg_schutzmassnahmen_kernidee_a",
          "text": "We should clearly understand export error, reporting path and safeguards in daily work and implement it properly.",
          "correct": true,
          "explanation": "This summarizes the core idea directly and in a practical way."
        },
        {
          "id": "quiz02_v01_ausbildungsbetrieb_exportfehler_meldeweg_schutzmassnahmen_kernidee_b",
          "text": "We can ignore export error, reporting path and safeguards as long as there is no time pressure.",
          "correct": false,
          "explanation": "The topic should not be postponed or waited out."
        },
        {
          "id": "quiz02_v01_ausbildungsbetrieb_exportfehler_meldeweg_schutzmassnahmen_kernidee_c",
          "text": "Only team management is allowed to deal with export error, reporting path and safeguards.",
          "correct": false,
          "explanation": "That makes the topic unnecessarily exclusive and misses the learning goal."
        },
        {
          "id": "quiz02_v01_ausbildungsbetrieb_exportfehler_meldeweg_schutzmassnahmen_kernidee_d",
          "text": "Export error, reporting path and safeguards only become relevant after the project ends.",
          "correct": false,
          "explanation": "The learning goal must be applied in daily operations."
        }
      ]
    },
    {
      "id": "quiz02_v01_ausbildungsbetrieb_exportfehler_meldeweg_schutzmassnahmen_praxisreaktion",
      "conceptId": "02_ausbildungsbetrieb_exportfehler_meldeweg_schutzmassnahmen_praxisreaktion",
      "variantId": "quiz02_v01_ausbildungsbetrieb_exportfehler_meldeweg_schutzmassnahmen_praxisreaktion",
      "isNew": false,
      "prompt": "Which response best fits Ticket 02 for export error, reporting path and safeguards?",
      "maxSelections": 1,
      "options": [
        {
          "id": "quiz02_v01_ausbildungsbetrieb_exportfehler_meldeweg_schutzmassnahmen_praxis_a",
          "text": "Briefly align, document cleanly and make the next step clear.",
          "correct": true,
          "explanation": "This combines clarification, transparency and actionable execution."
        },
        {
          "id": "quiz02_v01_ausbildungsbetrieb_exportfehler_meldeweg_schutzmassnahmen_praxis_b",
          "text": "Write nothing down at first and decide later by gut feeling.",
          "correct": false,
          "explanation": "That would be imprecise and risky here."
        },
        {
          "id": "quiz02_v01_ausbildungsbetrieb_exportfehler_meldeweg_schutzmassnahmen_praxis_c",
          "text": "Only address problems once they have fully escalated.",
          "correct": false,
          "explanation": "The right direction is to clarify early rather than escalate late."
        },
        {
          "id": "quiz02_v01_ausbildungsbetrieb_exportfehler_meldeweg_schutzmassnahmen_praxis_d",
          "text": "Avoid clarifying questions even when the goal is still unclear.",
          "correct": false,
          "explanation": "The learning goal demands clarity, not silent guessing."
        }
      ]
    }
  ]
}
