{
  "scenarioFolder": "LF01-Scenarien",
  "quizFolder": "LF01-Quiz",
  "scenarioFile": "ticket_ausbildungsbetrieb_praesentation_teamvorbereitung/ticket06_V01_ausbildungsbetrieb_praesentation_teamvorbereitung_en.json",
  "quizFile": "quiz_ausbildungsbetrieb_praesentation_teamvorbereitung/quiz06_V01_ausbildungsbetrieb_praesentation_teamvorbereitung_en.json",
  "ticketId": "06_easy_ausbildungsbetrieb_praesentation_teamvorbereitung.json",
  "versionId": "V01",
  "title": "Ticket 06 - Prepare presentation",
  "description": "Dummy data for Ticket 06 - prepare presentation (V01) in the DoomScrollQuiz.",
  "topics": [
    "Training company presentation team preparation",
    "Version 01"
  ],
  "questions": [
    {
      "id": "quiz06_v01_ausbildungsbetrieb_praesentation_teamvorbereitung_kernidee",
      "conceptId": "06_ausbildungsbetrieb_praesentation_teamvorbereitung_kernidee",
      "variantId": "quiz06_v01_ausbildungsbetrieb_praesentation_teamvorbereitung_kernidee",
      "isNew": true,
      "prompt": "In Ticket 06 the expert statement appears: \"Classify and apply presentation preparation and team preparation reliably in daily operations.\" What did he say?",
      "maxSelections": 1,
      "options": [
        {
          "id": "quiz06_v01_ausbildungsbetrieb_praesentation_teamvorbereitung_kernidee_a",
          "text": "We should clearly understand presentation preparation and team preparation in daily work and implement it properly.",
          "correct": true,
          "explanation": "This summarizes the core idea directly and in a practical way."
        },
        {
          "id": "quiz06_v01_ausbildungsbetrieb_praesentation_teamvorbereitung_kernidee_b",
          "text": "We can ignore presentation preparation and team preparation as long as there is no time pressure.",
          "correct": false,
          "explanation": "The topic should not be postponed or waited out."
        },
        {
          "id": "quiz06_v01_ausbildungsbetrieb_praesentation_teamvorbereitung_kernidee_c",
          "text": "Only team management is allowed to deal with presentation preparation and team preparation.",
          "correct": false,
          "explanation": "That makes the topic unnecessarily exclusive and misses the learning goal."
        },
        {
          "id": "quiz06_v01_ausbildungsbetrieb_praesentation_teamvorbereitung_kernidee_d",
          "text": "Presentation preparation and team preparation only become relevant after the project ends.",
          "correct": false,
          "explanation": "The learning goal must be applied in daily operations."
        }
      ]
    },
    {
      "id": "quiz06_v01_ausbildungsbetrieb_praesentation_teamvorbereitung_praxisreaktion",
      "conceptId": "06_ausbildungsbetrieb_praesentation_teamvorbereitung_praxisreaktion",
      "variantId": "quiz06_v01_ausbildungsbetrieb_praesentation_teamvorbereitung_praxisreaktion",
      "isNew": false,
      "prompt": "Which response best fits Ticket 06 for presentation preparation and team preparation?",
      "maxSelections": 1,
      "options": [
        {
          "id": "quiz06_v01_ausbildungsbetrieb_praesentation_teamvorbereitung_praxis_a",
          "text": "Briefly align, document cleanly and make the next step clear.",
          "correct": true,
          "explanation": "This combines clarification, transparency and actionable execution."
        },
        {
          "id": "quiz06_v01_ausbildungsbetrieb_praesentation_teamvorbereitung_praxis_b",
          "text": "Write nothing down at first and decide later by gut feeling.",
          "correct": false,
          "explanation": "That would be imprecise and risky here."
        },
        {
          "id": "quiz06_v01_ausbildungsbetrieb_praesentation_teamvorbereitung_praxis_c",
          "text": "Only address problems once they have fully escalated.",
          "correct": false,
          "explanation": "The right direction is to clarify early rather than escalate late."
        },
        {
          "id": "quiz06_v01_ausbildungsbetrieb_praesentation_teamvorbereitung_praxis_d",
          "text": "Avoid clarifying questions even when the goal is still unclear.",
          "correct": false,
          "explanation": "The learning goal demands clarity, not silent guessing."
        }
      ]
    }
  ]
}
