{
  "scenarioFolder": "LF02-Scenarien",
  "quizFolder": "LF02-Quiz",
  "scenarioFile": "ticket_ausbildungsbetrieb_stoerungsanalyse/ticket04_V01_ausbildungsbetrieb_stoerungsanalyse.json",
  "quizFile": "quiz_ausbildungsbetrieb_stoerungsanalyse/quiz04_V01_ausbildungsbetrieb_stoerungsanalyse.json",
  "ticketId": "04_easy_ausbildungsbetrieb_stoerungsanalyse.json",
  "versionId": "V01",
  "title": "Ticket 04 - Störungsanalyse",
  "description": "Dummy-Daten für Ticket 04 - Störungsanalyse (V01) im DoomScrollQuiz.",
  "topics": [
    "Ausbildungsbetrieb Störungsanalyse",
    "Version 01"
  ],
  "questions": [
    {
      "id": "quiz04_v01_ausbildungsbetrieb_stoerungsanalyse_kernidee",
      "conceptId": "04_ausbildungsbetrieb_stoerungsanalyse_kernidee",
      "variantId": "quiz04_v01_ausbildungsbetrieb_stoerungsanalyse_kernidee",
      "isNew": true,
      "prompt": "Im Ticket 04 taucht die Fachaussage auf: \"Ausbildungsbetrieb Störungsanalyse im Arbeitsalltag sicher einordnen und anwenden.\" Was hat er gesagt?",
      "maxSelections": 1,
      "options": [
        {
          "id": "quiz04_v01_ausbildungsbetrieb_stoerungsanalyse_kernidee_a",
          "text": "Wir sollen ausbildungsbetrieb störungsanalyse im Alltag klar verstehen und sauber umsetzen.",
          "correct": true,
          "explanation": "Das fasst die Kernidee von Ausbildungsbetrieb Störungsanalyse direkt und handlungsnah zusammen."
        },
        {
          "id": "quiz04_v01_ausbildungsbetrieb_stoerungsanalyse_kernidee_b",
          "text": "Wir können ausbildungsbetrieb störungsanalyse ignorieren, solange es keinen Zeitdruck gibt.",
          "correct": false,
          "explanation": "Ausbildungsbetrieb Störungsanalyse soll gerade nicht vertagt oder ausgesessen werden."
        },
        {
          "id": "quiz04_v01_ausbildungsbetrieb_stoerungsanalyse_kernidee_c",
          "text": "Nur die Teamleitung darf sich überhaupt mit ausbildungsbetrieb störungsanalyse befassen.",
          "correct": false,
          "explanation": "Die Aussage macht das Thema unnötig exklusiv und trifft die Lernidee nicht."
        },
        {
          "id": "quiz04_v01_ausbildungsbetrieb_stoerungsanalyse_kernidee_d",
          "text": "Ausbildungsbetrieb Störungsanalyse wird erst nach Projektende relevant.",
          "correct": false,
          "explanation": "Die Lernidee soll im laufenden Arbeitsalltag angewendet werden."
        }
      ]
    },
    {
      "id": "quiz04_v01_ausbildungsbetrieb_stoerungsanalyse_praxisreaktion",
      "conceptId": "04_ausbildungsbetrieb_stoerungsanalyse_praxisreaktion",
      "variantId": "quiz04_v01_ausbildungsbetrieb_stoerungsanalyse_praxisreaktion",
      "isNew": false,
      "prompt": "Welche Reaktion passt im Ticket 04 am besten zu Ausbildungsbetrieb Störungsanalyse?",
      "maxSelections": 1,
      "options": [
        {
          "id": "quiz04_v01_ausbildungsbetrieb_stoerungsanalyse_praxis_a",
          "text": "Kurz abstimmen, sauber dokumentieren und den nächsten Schritt klar machen.",
          "correct": true,
          "explanation": "Das verbindet Rückfrage, Transparenz und handlungsfähige Umsetzung."
        },
        {
          "id": "quiz04_v01_ausbildungsbetrieb_stoerungsanalyse_praxis_b",
          "text": "Erst einmal nichts notieren und später nach Gefühl entscheiden.",
          "correct": false,
          "explanation": "Gerade bei Ausbildungsbetrieb Störungsanalyse wäre das unpräzise und riskant."
        },
        {
          "id": "quiz04_v01_ausbildungsbetrieb_stoerungsanalyse_praxis_c",
          "text": "Probleme nur dann ansprechen, wenn sie bereits voll eskaliert sind.",
          "correct": false,
          "explanation": "Die richtige Richtung ist früh klären statt spät eskalieren."
        },
        {
          "id": "quiz04_v01_ausbildungsbetrieb_stoerungsanalyse_praxis_d",
          "text": "Rückfragen vermeiden, auch wenn das Ziel noch unklar ist.",
          "correct": false,
          "explanation": "Die Lernidee verlangt gerade Klarheit und nicht stilles Raten."
        }
      ]
    }
  ]
}
