{
  "scenarioFolder": "LF03-Scenarien",
  "quizFolder": "LF03-Quiz",
  "scenarioFile": "ticket_ausbildungsbetrieb_datenuebertragung_medien/ticket03_V01_ausbildungsbetrieb_datenuebertragung_medien.json",
  "quizFile": "quiz_ausbildungsbetrieb_datenuebertragung_medien/quiz03_V01_ausbildungsbetrieb_datenuebertragung_medien.json",
  "ticketId": "03_easy_ausbildungsbetrieb_datenuebertragung_medien.json",
  "versionId": "V01",
  "title": "Ticket 03 - Datenuebertragung & Medien",
  "description": "Dummy-Daten fuer Ticket 03 - Datenuebertragung & Medien (V01) im DoomScrollQuiz.",
  "topics": [
    "Ausbildungsbetrieb Datenuebertragung Medien",
    "Version 01"
  ],
  "questions": [
    {
      "id": "quiz03_v01_ausbildungsbetrieb_datenuebertragung_medien_kernidee",
      "conceptId": "03_ausbildungsbetrieb_datenuebertragung_medien_kernidee",
      "variantId": "quiz03_v01_ausbildungsbetrieb_datenuebertragung_medien_kernidee",
      "isNew": true,
      "prompt": "Im Ticket 03 taucht die Fachaussage auf: \"Ausbildungsbetrieb Datenuebertragung Medien im Arbeitsalltag sicher einordnen und anwenden.\" Was hat er gesagt?",
      "maxSelections": 1,
      "options": [
        {
          "id": "quiz03_v01_ausbildungsbetrieb_datenuebertragung_medien_kernidee_a",
          "text": "Wir sollen ausbildungsbetrieb datenuebertragung medien im Alltag klar verstehen und sauber umsetzen.",
          "correct": true,
          "explanation": "Das fasst die Kernidee von Ausbildungsbetrieb Datenuebertragung Medien direkt und handlungsnah zusammen."
        },
        {
          "id": "quiz03_v01_ausbildungsbetrieb_datenuebertragung_medien_kernidee_b",
          "text": "Wir koennen ausbildungsbetrieb datenuebertragung medien ignorieren, solange es keinen Zeitdruck gibt.",
          "correct": false,
          "explanation": "Ausbildungsbetrieb Datenuebertragung Medien soll gerade nicht vertagt oder ausgesessen werden."
        },
        {
          "id": "quiz03_v01_ausbildungsbetrieb_datenuebertragung_medien_kernidee_c",
          "text": "Nur die Teamleitung darf sich ueberhaupt mit ausbildungsbetrieb datenuebertragung medien befassen.",
          "correct": false,
          "explanation": "Die Aussage macht das Thema unnoetig exklusiv und trifft die Lernidee nicht."
        },
        {
          "id": "quiz03_v01_ausbildungsbetrieb_datenuebertragung_medien_kernidee_d",
          "text": "Ausbildungsbetrieb Datenuebertragung Medien wird erst nach Projektende relevant.",
          "correct": false,
          "explanation": "Die Lernidee soll im laufenden Arbeitsalltag angewendet werden."
        }
      ]
    },
    {
      "id": "quiz03_v01_ausbildungsbetrieb_datenuebertragung_medien_praxisreaktion",
      "conceptId": "03_ausbildungsbetrieb_datenuebertragung_medien_praxisreaktion",
      "variantId": "quiz03_v01_ausbildungsbetrieb_datenuebertragung_medien_praxisreaktion",
      "isNew": false,
      "prompt": "Welche Reaktion passt im Ticket 03 am besten zu Ausbildungsbetrieb Datenuebertragung Medien?",
      "maxSelections": 1,
      "options": [
        {
          "id": "quiz03_v01_ausbildungsbetrieb_datenuebertragung_medien_praxis_a",
          "text": "Kurz abstimmen, sauber dokumentieren und den naechsten Schritt klar machen.",
          "correct": true,
          "explanation": "Das verbindet Rueckfrage, Transparenz und handlungsfaehige Umsetzung."
        },
        {
          "id": "quiz03_v01_ausbildungsbetrieb_datenuebertragung_medien_praxis_b",
          "text": "Erst einmal nichts notieren und spaeter nach Gefuehl entscheiden.",
          "correct": false,
          "explanation": "Gerade bei Ausbildungsbetrieb Datenuebertragung Medien waere das unpraezise und riskant."
        },
        {
          "id": "quiz03_v01_ausbildungsbetrieb_datenuebertragung_medien_praxis_c",
          "text": "Probleme nur dann ansprechen, wenn sie bereits voll eskaliert sind.",
          "correct": false,
          "explanation": "Die richtige Richtung ist frueh klaeren statt spaet eskalieren."
        },
        {
          "id": "quiz03_v01_ausbildungsbetrieb_datenuebertragung_medien_praxis_d",
          "text": "Rueckfragen vermeiden, auch wenn das Ziel noch unklar ist.",
          "correct": false,
          "explanation": "Die Lernidee verlangt gerade Klarheit und nicht stilles Raten."
        }
      ]
    }
  ]
}
